build,build code error file files just like make project run use using want way
object,class code create function gt like lt method new object objects return use using value want way
dynamic,add class code create dynamic dynamically example function gt just know like lt make need new object set thanks type use using value var want way work
reference,amp class code does function just like lt new object reference references return type use using want way
installation,application file files install installation installed installer installing like need project setup user using ve want way windows
jquery-plugins,code com div function gt html http id javascript just like lt page plugin return script thanks type use using var want work
memory-management,alloc code does just know like memory new object problem release use using way
selenium,class code firefox http id java like lt open page run start test testing tests trying use using want way
swing,add class code java jframe jpanel like new problem public string swing true using void want way
macros,code define file just like macro macros studio use using ve visual want way work
javascript-events,click code document event events function gt html id input javascript jquery know like lt need page problem script text thanks type use user using value var want way window work
import,code data file files import importing like module need problem python use using ve want way
visual-c++,code error file function gt project studio use using vc visual
schema,create data database does file gt id like lt need new schema table tables use using want way xml
casting,cast casting class code data does error following gt int like lt method need new object public return string type use using value way
generics,class code does following generic generics gt interface java like list lt method new object public return static string type types use using value void want way
magento,add code gt help know like lt mage page php product products thanks trying using want
tcp,application client code connection connections data ip know like new port problem send server socket tcp thanks time use using way
hyperlink,click code com gt href html http hyperlink know like link links lt page text url use using want way
sqlite3,app code create data database db error file help id just like problem query select sql sqlite sqlite3 table thanks use using way
