flex,actionscript add adobe app application button class click code com component create data does don error event example file flash function gt help http id just know label like lt make mx mxml need new object private problem project public script set text thanks tried true trying use user using var ve void want way width work works xml
actionscript-3,actionscript add addchild addeventlistener application as3 button class click code com create data display does doesn don error event example file flash flex function gt help http import just know like load lt make movieclip need new number object private problem public set stage string swf text thanks trace true trying use using var ve void want way width work works xml
air,access adobe advance app application code com create data does don file files flash flex function gt http just know like lt make mx need new possible text thanks tried trying use used using var want way window work works
svn,access add build change changes check checkout code command commit control copy create directory does don error file files folder following just know like local make need new possible problem project projects question repo repository revision run running server set source subversion thanks time tortoisesvn tried trunk trying update use used using ve version want way windows work working
tortoisesvn,add branch changes checked checkout code command commit control copy create created delete different directory does doesn don error file files folder folders following help just know like local make merge need new problem project repo repository revision right server solution source subversion thanks time tortoise tortoisesvn tried trunk try trying update use using ve version visual want way windows work working
sql,10 code column columns create data database date does error example field following gt help id insert join just key know like lt mysql need new null number order possible problem query question result return row rows select server set statement stored table tables thanks time trying type update use user using value values ve want way work
asp.net,add application aspx button class click code control create data database does don error file following gt help http id just know like load lt make method need new object page problem runat server set site string text thanks time true trying type use user using value ve want way web work working works
algorithm,10 algorithm algorithms array best better code data does don edit example following function given gt help int just know like list looking lt make need new number numbers point possible problem question return set solution string thanks time trying use used using value ve want way
language-agnostic,algorithm application best case code data different does doesn don edit end example function good just know language languages like list looking make need new number point possible problem programming question really simple solution things think time use used using value ve want way work write
colors,background blue change code colors colour different does don file following function gt hex image just know like lt make need new possible problem red rgb set text thanks tried use using value ve want way white work working
c#,add application class code create data does don error example file following gt help int just know like list lt make method need net new object possible problem public question return server set string text thanks time trying type use user using value ve void want way windows work
.net,add application class code create data does don error example file following gt just know like lt make method need net new object possible problem public question return server set string thanks time trying type use user using value ve want way windows work
scripting,add application bash code command create data does doesn don error example file files following gt just know language like line lt make need new number output possible problem process question run running scripting scripts server set shell text thanks think time trying use used user using ve want way windows work works write
compiler-construction,build class code compile compiled compiler compilers compiling does don error example file following function gcc gt int just know language like lt make need net new problem program project question really return run source time type use used using ve visual void want way windows work
c++,amp application char class code const cout create data does don error example file following function gt help include int just know library like lt main make need new object possible problem program public question return std string thanks time trying type use used using value ve void want way windows work
oop,access add application best better called case classes code constructor create data design different does don example following function good gt instance interface just know like lt make method methods need new object objects oop oriented php private problem public question return say set static string thanks think time trying type use used using value ve void want way work
class,add array called classes code create data different does doesn doing don error example file following function functions gt help instance int java just know like list lt main make method methods need new object php possible private problem public question return set string test thanks trying type use used using value variable ve void want way work
web-services,access add app application asmx asp class client code com create data database does don error example file following gt help http java just know like lt make method need net new object problem project public question reference request response return server services set soap string thanks time tried trying type url use used user using ve want way wcf webservice work wsdl xml
sql-server,2005 2008 application code column columns create data database db does don error following help id insert just know like need net new null problem procedure query question rows run select set statement stored table tables thanks time trying update use user using value values ve want way work
sql-server-2005,10 2005 code column create data database dbo does error following help id insert int just know like lt need new null possible problem procedure query result rows run select set stored table tables thanks time trying update use user using value values ve want way
deployment,add app application applications asp best build code configuration create data database deploy deployed deploying deployment development different directory does don environment error file files fine folder following help http iis install installed just know like machine make need net new possible problem process production project run running script server set setup site solution sql studio thanks time tried trying use used user using ve version visual want way web windows work working works
visual-studio,2008 2010 add application build class code create debug does don error file files help just know like make need net new possible problem project projects run server set solution source thanks time trying use using ve vs want way web windows work
windows,application code create does don error exe file files gt help just know like make need net new possible problem process program run running server set thanks time trying use user using ve want way work
installation,2008 add app application code create created directory does don error file files folder following install installation installed installer installing just know like machine make msi need net new problem program project run running server set setup solution studio thanks tried trying use user using ve version visual want way web windows work write
database,access add application best code column create data databases db different does don example file gt help id just key know like make mysql need new php possible problem query question select server set sql store table tables thanks time trying type update use used user using value ve want way work
loops,10 add amp array class code create data does doesn doing don end error example file following foreach function gt help id inside int just know like list looping loops lt make need new number php possible problem return run say start string thanks time trying use using value var variable ve want way work write
unix,code command directory does don error file files following gt just know like line linux lt need new output problem process program run running script shell thanks time trying unix use using want way work
msbuild,application assembly building builds built code com command config configuration copy csproj custom debug different directory dll does doesn don edit error exe file files fine folder following framework gt http include just know like line lt machine message microsoft need net new output possible problem process project projects properties question really release run running script server set sln solution source studio target targets task tasks test tfs thanks time tried true trying use used using value ve version visual vs want way web windows work working works xml
web-applications,able app application applications asp based best browser client code create data database different does don example file files good help html http java just know like looking make need net new page possible problem project question run server set site thanks time trying type use used user users using ve want way work
dns,access address application change com create different dns does domains example file google help host http ip just know like looking make need net new page possible problem question server set site sub subdomain subdomains thanks trying use user using ve want way web windows work works www
.net-3.5,able add app application asp class code control create data does don error exception file following framework gt help int just know like linq lt make method need net new object page possible problem project public question really return run server service set solution string thanks time tried trying type use user using value ve version void want way web windows work works
sql-server-2008,2008 code column create data database db dbo does don error example following gt help id insert just know like lt need net new null problem procedure query question rows run select set stored studio table tables thanks trying type update use user using value values ve want way work
unit-testing,application assert best class code create data database different does don error example file following framework good gt just know like lt make method methods mock need net new object problem project public question return run running set setup string testing tests thanks time true trying use used using ve void want way work write writing
testing,app application class code create data development different does doesn doing don example file good gt just know like make method need new problem project question run running server set testing tests thanks think time tool tools trying unit use used using ve want way web work working write
version-control,able best better branch build change changes check code commit control copy create currently developers development different does doesn don file files git good having just know like local make mercurial need new possible problem project projects question really repository server set solution source studio subversion svn team thanks time update use used using ve version visual want way windows work working
postgresql,application code column create data database db does doing don error example file following function gt help id insert just key know like need new null postgres problem query result return row rows run running select server set sql table tables thanks time tried trying type update use used user using value values ve want way work
stored-procedures,add application begin code create created data database date dbo declare does don end error exec execute following gt help id insert int just know like lt mysql need net new null object parameter parameters possible problem proc procedures query question result results return returns run select server set sp sql statement string table tables thanks time tried try trying type update use used user using value values varchar ve want way work working
triggers,add begin change changes check code column create data database delete deleted does doesn don end error example field following gt help id insert inserted join just key know like lt mysql need new null possible problem procedure property query question record row rows select server set setter sql statement table tables thanks time triggers true trying type update updated use used user using value values want way work works
dataset,add application asp code column columns create data database datarow datasets datasource datatable does doing don ds edit error example file following gt help id insert just key know like load lt method need net new object possible problem read row rows select server set sql string table tables thanks time tried trying type typed update use used using value values ve want way work working xml
datatable,add asp best change class code column columns contains create created currently data database datarow dataset datasource does don dt example field file following foreach gt id int just know like linq list lt method need net new object problem public query result return returns row rows select server set sql string table tables thanks tostring trying type use using value values var ve want way work works write
asp-classic,able amp application classic code com createobject data database does don end error example file files following form function getting gt help html http id iis just know like lt make need net new object old open page pages possible problem request response server set site sql string sure text thanks time trying type use user using value vbscript ve want way web website work working write
vbscript,able add amp application asp classic code com create createobject dim does don end error example file files following function gt help http just know like line lt message microsoft need new object open problem run running script select server set string test text thanks tried true trying type use using value vb vbs ve want way windows work works write wscript
html,background body browser class code com content css display div document does don element example file form function gt height help href html http id image input javascript jquery just know left like link lt make need new page php possible problem right script set src style table tag text thanks tried trying type use user using value ve want way web width work working works www
autocomplete,add ajax auto box change code com complete data does don event example field form function gt help html http id input item javascript jquery js just key know like list lt make need net new page php plugin possible problem result results return script search select server set source suggest text textbox thanks tried trying type typing ui use used user using value var ve want way work working works
c,amp array char code data does don error example file following function gt help include int just know like lt main make memory need pointer possible printf problem program question return stdio string struct thanks time trying use used using value ve void want way work write
architecture,access add app application applications approach architecture asp based best better business case class classes client code create data database db design different does don example framework good information just know layer like logic looking make method model multiple need net new object objects problem project question read say server service services set solution sql thanks think time type use used user using ve want way web work write
data-structures,able add array best better class code create data database different does don efficient example file function good gt help implement implementation int java just know like list looking lt make memory method need new number object objects possible problem question read return set simple store string structure structures table thanks think time tree type use used using value values ve want way
flash,actionscript application as3 class code com create data display does don event file files flex function gt help html http javascript just know like load lt make movie need new object page player possible problem set swf text thanks trying type use user using var ve video want way work working works
video,app application best code com data does don file files flash flv format frame good help http image just know like looking make need play player possible server source start stream thanks time use user using ve videos want way youtube
powershell,able add application cmdlet code command create does doesn don error example exe file files following function gt help just know like line lt method microsoft need net new object open output ps ps1 run running script scripts server set string test thanks time tried trying use user using ve want way web windows work works write
optimization,10 add array better case code compiler create currently data does doing don edit example faster file following function given good gt help id int just know like loop lot lt make method need new number optimization optimize optimizing order performance possible problem query question really return run select set simple size slow speed string table takes thanks think time times type use used user using value ve want way work
winforms,able add app application button change class click code control controls create data display does doesn don event form forms help just know like make method need net new object possible private problem property public sender set string text thanks time tried true use user using value ve void want way windows winform winforms work working works
error-handling,app application asp best case catch check class code custom data database display does doesn don end errors example exception exceptions file following function good gt handle handler handling help http information instead just know like log lt message method need net new null object occurs page php possible problem public question really request return server set string thanks throw time try trying type url use used user using ve want way web work
user-controls,able add added application ascx asp binding button class click code com contains content controls create created custom data design different does doesn doing don error event example following form grid gt height help http id inside instance just know like list load lt make method microsoft namespace need net new null object page partial possible private problem properties property public return runat sender server set simple string text textbox thanks time tried true trying type use used user usercontrol usercontrols using value ve void want way web width window windows work works wpf xaml xmlns
php,array class code com create data database does don echo error example file following form function gt help html http id just know like lt make mysql need new page post problem query question return script select server set string table text thanks time trying type url use user using value ve want way work working
mysql,10 code column create data database date db does don error example field following gt help id insert join just key know like lt make need new null order php possible problem query question result row rows select server set sql table tables thanks time trying type update use user users using value values ve want way work
security,able access app application asp authentication best client code data database does don example file files http information just know like login make method need net new page password php possible problem question run secure security server service set site thanks time use used user users using ve want way web windows work
full-text-search,2005 2008 able based best code column contains create data database different documents does don example field file following fulltext help id implement index indexing just key know like list looking lucene match ms mysql need new pdf possible problem query question rank really result results return returns searches searching select server set solution sql stored string table tables thanks trying type use used user users using ve want way word words work working
math,10 algorithm calculate code does doing don example following function given gt help int just know like looking lt math method need number numbers point points possible problem question result return right set simple solution thanks time trying use using value values ve want way work
ruby,app application class code create data def does doesn don end error example file following gt http id just know like lt make method need new problem rails rb run thanks time tried trying use user using ve want way work works
64bit,2008 32 32bit 64bit app application build code com compile dll does doesn don environment error file files fine following getting got gt help information just know library like load lt machine memory microsoft mode need net new os platform problem problems process program project run running server set solution source studio thanks tried trying type use used using ve version visual want way windows work working works x64 x86
java,add application class code create data does don error example file following gt help int just know like lt main make method need new null object possible problem public question return run server set static string thanks time try trying type use using value ve void want way work
ado.net,access add ado application asp code command connection create data database dataset datatable does don entity error example following framework gt help id insert int just know like lt make method need new object open parameters possible problem query read return row select server set sql sqlcommand sqlconnection stored string table tables thanks try trying type update use using value ve want way work
user-interface,able add app application best button class code control create data display does doesn don example form good gui help interface java just know like list make need net new possible problem question set text thanks time trying ui use used user using ve want way window windows work
xml,add amp attribute class code com create data document does don element elements encoding error example file files following gt help html http id just know like lt need net new node object org parse parsing problem question read select set string text thanks tried trying type use using utf value ve version want way work write www xmlns
regex,amp characters code com does doesn example expression expressions file following function gt help html http just know like line lt match matches need new pattern php preg problem regex regexp regular replace return string text thanks tried trying use using ve want way work
email,address app application body client code com content data does don emails error file gmail gt help html just know like lt mail message need net new open php possible problem script send sending sent server set smtp string subject text thanks time trying type use used user users using ve want way web working
forms,action add ajax button class click code com create data div document does doesn don error example false field fields forms function gt help html http id input javascript jquery just know label like lt make method need new page php post problem question return script select set simple submit text thanks time tried true trying type update url use user using value values var ve want way work working works
sharepoint,2007 2010 able access add application code content create created custom data document does error field file fine following gt help http item just know library like list lt microsoft moss need new page possible problem server set site sites solution string thanks tried trying type use used user users using ve want way web work works
assemblies,add app appdomain application asp assemblies bin build built class classes code com configuration contains create dependencies different directory dll dlls does don error exception exe file files fine folder following gac gt help just know like load loaded lt make microsoft namespace need net new party possible problem project public publickeytoken question reference referenced references run runtime solution string studio thanks tried try type use used using ve version visual want way web windows work works
vb.net,add amp application asp byval class code create data dim does don end error file following form function gt help just know like lt make method need new object page problem public return select server set string sub text thanks tried trying type use user using value vb ve visual want way windows work working works
date,00 09 10 12 2009 2010 add code convert current data dates datetime day days dd does don example following format function gt help java javascript just know like lt mm month mysql need new php query return select set sql string thanks time today trying use using value ve want way work year yyyy
indexing,10 add best code column columns create data database does doing don example field fields following gt having id indexed indexes indexing int just key know large like list lt make mysql need new null number order performance possible primary problem queries query question rows say search select server sql sure table tables text thanks time type unique update use used user using value values ve want way work
