events,class click code event events function gt like lt need new object problem use using void want way
pdf,document file files know like need open page text thanks use using want way
xpath,attribute document element elements following gt http id like lt need node nodes select tried trying use using value want way xml xpath
dns,com dns domain domains http know like server site use using want way www
asp.net-ajax,ajax asp code control does gt id javascript know like lt net page panel server thanks update updatepanel use using value want way web
css,background class code css div gt height html id left like lt page right style text thanks using want way width
powershell,command file just like line new object run script string use using ve want way windows
embedded,code device embedded just like need use using
listbox,add binding code control gt item items like list lt new problem property selected set text true use using value want way width wpf
xml,code data file gt http like lt need new string thanks use using value want way
windows-mobile,application code device know like mobile need net thanks using windows
language-agnostic,code example just know language like need question time use using want way
web-config,add app application asp code configuration file gt just like lt need net server use using want way
attributes,attribute attributes class code gt like lt new possible property public set string type use using value want way
bitmap,bitmap code create data does file height image know method need new problem thanks use using want way width
passwords,database just like need password passwords server use user users using want way
c#,class code gt like lt need net new string use using want way
triggers,create database end gt id insert inserted like lt need new row select server set sql table thanks trigger triggers update use using value want way
sorting,array gt like list lt need order sort sorted sorting use using want way
lambda,class code does expression expressions following func function gt int know lambda like linq list lt method new object public return string type use using var want way
variables,code function gt like lt new php thanks use using value variable variables want way
serialization,class code data deserialize does file gt like lt need new object objects problem public return serialization serialize serialized set string trying type use using want way xml
sql-server-2005,2005 data database like need query select server sql table use using want way
web-services,application client code data http like need net new server service services use using want way web webservice xml
windows-vista,application code does error file just like microsoft need problem program run running use user using vista windows work xp
input,code function gt input like lt need text thanks type use user using value want way work
comparison,compare comparison different does gt like lt new string using want way
orm,class code column data database entity gt hibernate id just like lt mapping need new object objects orm query sql table use using want way
opengl-es,2d code does don draw es gl iphone just know like make need opengl texture use using ve void want
.htaccess,apache com directory example file files help htaccess http index like mod need page php redirect request rewrite rewritecond rewriteengine rewriterule server site thanks url using want work www
website,does just know like page site thanks using want way web website
asp-classic,application classic code error gt like lt need net page server set thanks use using value want way
flex3,application code data flex function know like lt mx new thanks using want
scripting,command does file files just know like need run script use using want way
frameworks,application code framework frameworks just know like php thanks use using way web
types,class data gt int like lt new string type types use using want way
mono,application code does like linux mono net run use using windows work
extjs,code data does ext extjs form function grid gt id items like lt new panel store text thanks title true use using var want way width
inheritance,base class classes code does example following function gt inherit inheritance int like lt method new object public return string type use using void want way
coding-style,class code coding just like lt style use using ve way
gwt,app application client code com google http java know like need new server thanks use using want way web
url,code com example http like need page php string thanks url urls use using want way www
jsf,application bean class code gt id java jsf like lt new page problem public use using value web
ssl,certificate client code connection does error http https know need secure security server set ssl use using want way web
api,api code com http know like thanks use using want
button,buttons click code gt id like lt make new text thanks use using want way
spring,application bean beans class code com context exception file gt id java like lt method new org problem property public springframework string use using value want way web xml
dependency-injection,application class code constructor container create dependency di gt inject injection instance interface ioc just like lt method need new object public service type use using void want way
iis-7,2008 access add application asp code config does error file gt http iis iis7 just like lt net new page problem request running server set site trying use using ve web windows work works
ios,app code ios iphone know like thanks use using view want way
audio,audio code file know like need play sound thanks use using want way
windows-services,application code does file like need net new run running services start use user using way
netbeans,application code does file ide java like problem project run use using want
php,code file function gt like lt need php thanks use using want way
upload,code data file files form image like need php post server thanks upload uploaded uploading uploads user using want way web
maven-2,build configuration dependencies dependency file gt jar java like lt mvn org plugin pom project repository run use using version want way xml
build-process,build code don file files like make need process project projects run source use using want way
proxy,code does http like need net server set use using want way work
file-upload,asp code data file files form gt http like lt need net new php post problem server thanks type upload uploaded uploading uploads use user using want way
arrays,arrays code function gt int like lt need new php string use using value want way
sql-server-2000,2000 data database date like need query select server set sql table use using want way
hibernate,class code column database entity gt hibernate id java like list lt mapping need new object org private problem property public query return session set sql string table use using value want way
gridview,asp button code column columns control data event false grid gt id like lt need net new object page row rows runat server set text true use user using value void want way
applet,applets application browser class code does file gt java know lt need new page problem run using want way web
post,action application code data form function gt http input like lt method need new page php request send server submit text trying type url use user using value want way
ms-access,access code data database form like microsoft ms need query select sql table use using want way
haskell,code data example function gt haskell like list type use using want way
ftp,code download file files know like need net new server trying upload use using want way
properties,class code file gt like lt new object properties property public return set string use using value want way
silverlight,application code control gt like lt need new silverlight thanks use using want way
c#-4.0,class code gt int just know like lt method need net new object problem public return string type use using void want way
excel-vba,cell code column data dim end excel help like macro need new range row set sheet thanks using value vba want way
sharepoint-2007,2007 custom like list need new page server sharepoint site thanks user using want way web
internet-explorer,browser code css does explorer fine firefox function gt html http internet javascript jquery like lt page problem text using work works
firefox,browser chrome code does firefox function gt html http javascript like lt page problem text thanks use using way work works
interface,class classes code gt implement implements interface interfaces just know like lt method methods need new object public type use using want way
timer,class code event example interval like need new object problem run seconds start thanks thread time timer timers use using void want way
lucene,code document documents does field index like lucene need new query results search solr text use using want way
full-text-search,database does example fulltext index like need problem query results search searching select server sql table text thanks use using want way word
ipad,app application code does ipad iphone know like thanks use using view want way
java,class code java like lt new public string use using want way
wordpress,blog code content function gt http know like lt need page php post posts site thanks use using want wp
git,branch changes commit file files just like master new remote repo repository use using ve want way work
autocomplete,auto autocomplete code complete data function gt input jquery just know like list lt text thanks type use user using value ve want
xsd,attribute complextype data element elements file following gt http like lt minoccurs need org possible schema sequence string type use using value want way xml xs xsd
search,know like need results search searching using want way
resources,application code file files gt like lt project resource resources use using ve way
tfs,2008 2010 build code control does file files foundation like new project server source studio team tfs use using visual want way work
data-binding,bind binding bound class code control data databinding gt like list lt need new object path property public set string text thanks type use user using value want way work wpf xaml
join,data following gt id join joins left like mysql need problem query select sql table tables thanks use using want way
soap,client code data error gt http like lt message need net new org problem request response server service services soap string trying type use using want way web wsdl www xml
vb6,application code error file like need net thanks use using vb vb6 want
nhibernate,add class code column data database entity following gt id like lt mapping need new object property public query return session set sql string table type use using want way
svn,changes code commit file files just like project repository server subversion svn use using version want way working
graph,algorithm data graph know like need nodes use using want way
java-ee,application class ee file java know like need new server use using want way web
listview,add android code data display gt id int item items layout like list lt new public row set string text thanks use using view want way
deployment,app application deploy deploying deployment does file files like need net new project run server use using version way web
module,code file import like module modules python use using want way
jquery-ui,class click code div function gt http id like lt page text thanks ui use using want way work
cakephp,array cakephp code controller data function gt id like model php set table use user using view want
design,application class code create data design good just know like need new question use user using want way
android,activity android app application code like new thanks use using view want way
linux,code file like linux need use using want way
function,code function functions gt like lt return use using want way
cocoa,app application cocoa code just like thanks use using want way
uiviewcontroller,add addsubview alloc app application bundle button code controller does initwithnibname iphone just like method navigationcontroller nil problem self set thanks uiview uiviewcontroller using ve view views want way yes
localization,app application code english file files language languages like localization localized need net resource string strings text use using way
xcode,app application code file iphone like project thanks use using want xcode
com,application class code com dll does error interface know like need net new object thanks use using way
image-processing,code image images like need processing thanks use using want way
menu,code gt item items like lt make thanks use user using want way
multidimensional-array,2d arrays code data dimensional function gt int key like lt multi multidimensional need new php thanks using value want way
header,code file gt header headers just like lt need page php using want
mod-rewrite,amp apache com example file filename help htaccess http index like mod nc need page php redirect request rewrite rewritecond rewriteengine rewriterule rule site thanks url urls use using want work works www
spring-mvc,application bean class controller error following form gt id java jsp like lt method mvc need new object org problem public request requestmapping return servlet springframework string use using value view want way web xml
sockets,application client close code connect connection data does error just like new port problem read send server socket sockets tcp thanks use using want way
algorithm,algorithm example just know like need number problem use using want way
floating-point,code does double float floating int know like number numbers point problem result using value values
constructor,class code constructor constructors does example following function gt int like lt method new object private public return string use using void want way
django,class code django like model models return use user using want way
validation,asp class code error form gt input like lt need net text type use user using validate validation value want way
count,code count gt id like mysql need number query result rows select sql table want way
optimization,code does gt just know like lt need optimize possible time use using way
cross-browser,browser browsers chrome code css firefox function gt html http javascript lt page text type using work works
jquery,ajax class click code div function gt html id javascript jquery like lt page text thanks type use using var want
parsing,code data example file gt just know like lt need parse parser parsing string text use using want way xml
internationalization,application code does en english file files gt i18n just language languages like locale set string text use using want way
actionscript-3,actionscript as3 class code event flash flex function like new using var void want way
zend-framework,application array code controller file form framework function gt like new php thanks use using want way
asp.net-membership,add application asp authentication code config database does gt know like login membership need net new page password provider security thanks use user username users using want way web
plsql,begin code create data end error id like need number oracle pl procedure query select sql table type use using values want way
installer,application file files install installation installed installer like msi need project run use user using want way windows
visual-studio,2008 code does file just like net project studio use using visual vs way
select,data gt id like lt mysql need query set sql table thanks use using value want
gcc,code compile compiler does error file following function gcc gt include int like lt main use using way
documentation,code document documentation does good know like use way
.net-3.5,application code error gt know like lt need net new string use using want way
multithreading,application class code does like main method new object problem run start thread threads time use using void want way
testing,application code just like run test testing tests unit use using want way
loops,array code example gt like loop loops lt need new trying use using value want way
windows-xp,application does error file like machine problem run running use using way windows work xp
transactions,application code commit data database does error exception insert like need new problem rollback sql table transaction transactions update use using want way
java-me,application blackberry code j2me java mobile need new use using want
canvas,2d code draw drawing element function gt height html5 image javascript like lt new thanks use using var want way width work
tsql,column data following id like need query select server set sql table use using want way
treeview,add code control data gt items like lt need net node nodes selected text thanks tree true using want way wpf
caching,application asp cache cached caching data does file like need net new page server time use using want way web
continuous-integration,build builds ci code continuous does file hudson integration just like need net problem project projects run running server test tests time use using ve want way work
charts,chart charting charts data does like need new thanks use using want way
console,app application code does like need output run use using want way windows
data-structures,data example gt just know like list need structure use using want way
database-design,best create data database design example id just key know like need sql store table tables use user users using want way
recursion,code function gt help int just know like list lt new recursion recursive return thanks use using want way
ios4,app code ios iphone know like thanks using view
datatable,add code column columns data datarow datatable gt know like lt need net new object row rows select string table thanks use using want way
routing,action application asp com controller create following gt http id index just like mvc net new page rails route routes routing thanks url urls use user using want way work
emacs,buffer code does file just like mode use using ve want way
linker,build code does error errors file files function gt include int know ld lib libraries library like link linker linking lt main problem program project static symbol undefined use using visual
c,char code function gt int like lt program return use using way
html,code css div gt html id javascript like lt page text type use using want way
dom,code div document dom element function gt html id javascript jquery like lt page text use using var want way
winforms,application code control form forms like need net new set use user using want way windows winforms
callback,callback callbacks class code data function gt jquery just know like lt method need new object problem return thanks trying use using want way work works
reflection,assembly class code gt know like lt method need net new object public reflection return string type use using void want way
r,10 data example frame function just like lt thanks use using want way
html5,browser canvas code gt html html5 javascript like lt use using way
jar,application build class classes code does eclipse file files java just know like main new project run trying use using want way
controls,application code control controls form like net new text use using want way
tortoisesvn,changes commit copy file files folder like need new project repository subversion svn thanks tortoise tortoisesvn trunk update use using version want way work working
image,code file gt image images img like lt new thanks using want way
animation,animate animation code gt image like lt new thanks time using want way work
login,code know like log logged login need page password php session site thanks use user username users using want way
xml-serialization,add class code data deserialize file gt like list lt need net new object objects public return serialization serialize serializer serializing set string thanks trying type typeof use using value want way xml xmlserializer
visual-studio-2008,2008 code file like net project studio use using visual vs vs2008 want way
ruby-on-rails-3,app application class controller end error following gt id just like lt method model new rails rb ruby thanks use user users using want way
ado.net,add ado code connection data database like need net new server sql string table use using want way
string,code example gt like lt string strings use using want way
blackberry,app application code device new thanks use using want
compiler-construction,code compile compiler does like use using want
utf-8,byte character characters code data does encoded encoding file gt html http like lt need new php problem string text unicode use using utf utf8 way work
plugins,code like plugin plugins thanks use using want way
entity-framework,class code context create data database does ef entities entity framework gt id like linq lt model need net new object return sql table use using want way
memory-leaks,alloc application code does gt just leak leaks like lt memory new object objects problem release return time use using void
scope,class code does example following function gt like lt method new return scope use using value var variable want way
class,classes code function gt just like lt method need new object public return string use using want way
jboss,application class code deploy does file following java like need org run server use using way web xml
encryption,aes code data decrypt encrypt encrypted encryption key know like need new password string thanks use using want way
uiview,add addsubview alloc app code iphone just like method screen self set thanks tried uiview using view views void want way
c++,amp class code function gt int like lt return use using want way
cocoa-touch,app code iphone like self use using view want way
makefile,build code command compile does error file files like make makefile problem run source use using want way work
core-data,alloc app application code core coredata data entity error iphone just like model need new nil object objects self set store thanks use using want way
rss,code com feed feeds gt http just know like lt need php rss thanks url use using want way xml
coldfusion,code coldfusion data file gt like lt thanks type use using value want way
servlets,application class code file gt http java jsp like lt need new request server servlet servlets use using want way web
random,code generate int like number numbers rand random time use using want way
jpa,class code column database entity gt hibernate id java jpa like list lt new object persistence private problem public query string table use using way
uiwebview,app application code com display does html http iphone like load loading nsstring page self thanks url use using view way web webview
safari,browser chrome code does firefox gt html iphone javascript like lt page problem thanks using ve width work works
vector,amp class code function gt int like lt need new push return size std use using vectors want way
twitter,api code com http just like oauth status thanks tweet tweets use user using want way
mysql,data database id like mysql need php query select sql table thanks use using want way
jqgrid,10 add code colmodel column data datatype edit false function grid gt id index jquery json like lt page pager row rowlist rownum rows select sortname table thanks true url use using value var viewrecords want width
drag-and-drop,able application code data does drag dragged dragging drop event function jquery like need thanks use user using want way
memory,application code does know like memory need use using way
regex,code example expression gt like lt match need regex regular string text use using want
insert,column create data database gt id inserting like mysql new query row rows select sql table trying update use using value values want way
ajax,ajax code data function gt html id javascript jquery like lt new page php post problem request return server text thanks type url use user using var want way
locking,application code data like lock locked locking locks make need new read sql thanks thread threads time update use using want way
interface-builder,app builder code created file ib interface iphone know like nib run thanks using view way
qt4,class code gt like need new qt qt4 thanks use using want
crystal-reports,application data need net report reports use using want
f#,code does function gt just let like list lt new type use using way
naming-conventions,class convention conventions just like names naming use
facebook,api app application code com connect fb gt http know like page php thanks use user using want way
shell,bash command file files like line script shell use using want way
include,class code does example file files gt include included includes like lt need php use using want way
jsp,code file gt html java jsp like lt page problem request thanks use using value want way web
table,code column create data gt help html id just like lt make need new row rows set tables td thanks tr trying use using want
character-encoding,character characters charset code data database encoding file gt html like lt need php problem set string text unicode use using utf
.net-4.0,application class code does framework gt just like lt method net new use using ve way
iis,application asp code does error file http iis just like need net page running server set site use using way web windows
model,class code create data database does following gt id know like lt model models need new object rails thanks use user using view want way
scala,case class code def error example following gt java just like list lt method new object scala string type use using val want way
