drop-down-menu,asp code data drop dropdown dropdownlist form gt html id item items like list lt need net new option page problem select selected text thanks user using value want way
path,code directory file like path paths use using want way
replace,example file function gt know like lt need replace search string text use using want way
datagridview,add cell code column columns data datagridview datasource form grid like new object problem row rows set use using value want way
stored-procedures,code create data database end error like new procedure procedures query return select server set sql stored table use using want way
perl,code file gt like line lt new perl print script use using want way
url-rewriting,asp code com example file gt htaccess http index like lt net page php redirect request rewrite rewriterule rewriting rule server site thanks url urls use using ve want way web work www
fonts,does font fonts know like text use using want way
rubygems,bin error file gem gems gt http install installed installing just lib like local problem rails rb ruby rubygems running tried update use using usr ve version work
scroll,code gt height like lt need page position problem scroll scrolling text thanks user using want way work
dll,application code does error file function like need net project use using way windows
excel,cell code data file like need new sheet use using value vba want way
mfc,application code dialog like mfc use using want way
concurrency,class code concurrency concurrent data does java like need new problem question thread threads time use using want way
flex,application code flex function gt like lt mx new thanks use using var want way
interop,application class code com dll file following interop like method need net new object problem string use using want way
prototypejs,ajax class code div element event function gt html id javascript jquery js like lt method new observe page prototype script text trying use using var want work
encoding,character characters code data encode encoded encoding file gt like lt problem string text use using utf way
activerecord,activerecord base belongs class create database def gt id like lt method model new problem rails record table use user using want way
command-line,command file files like line need program run script use using want way windows
uitableview,alloc app cell cellforrowatindexpath cells code indexpath iphone like nil nsindexpath problem return row self set table tableview text thanks uitableview uitableviewcell using view void want way
symfony1,class create doctrine error file gt id like new php symfony thanks use using want way
boost,amp class code const error function gt include int library like lt return std type use using void want
cookies,browser code com cookie cookies does http like new page php problem server session set site use user using value want way
ruby-on-rails,code gt id like lt method new rails ruby thanks use user using want way
windows-installer,application create does exe file files install installation installed installer just like msi need project run setup use user using want way windows wix
file,code file files like need read thanks use using want way
compilation,build code compile compiling error file files know like make need run use using way work
crash,app application code crash crashes does error exception file just like log problem run running time trying using windows
xslt,1999 apply code element encoding file following gt html http like lt match need node org output select stylesheet template test text thanks transform use using value version w3 want way www xml xmlns xsl xslt
sql-server-2008,2008 data database like need query select server sql table use using want way
tomcat,apache application error file gt http java like lt new org run running server servlet use using web xml
dialog,box button class click code false form function gt id jquery like lt modal new open text thanks title true ui use user using want way window
silverlight-3.0,application code control data does gt know like lt new object problem set silverlight thanks use using want xaml
binding,bind binding class code data gt itemssource just like lt need new object path problem property public return set source string text thanks true type use using value want way work wpf xaml
air,adobe air app application code file flash flex know like need thanks use using want
mocking,class code create example framework gt interface just like lt make method methods mock mocking mocks moq need new object problem public return returns string test testing tests trying unit use using ve void want way work
permissions,access application code file like need new permission permissions read server set use user users using want way
https,application certificate code com connection error http need page post problem request server site ssl thanks url use user using web works
layout,android code content gt height just layout like lt new problem text use using want way width
mercurial,changes code commit file files hg just like mercurial new project repository use using version want way work
database,data database db like mysql need sql table tables thanks use using want way
web-applications,app application know like need server use user using want way web
refactoring,class code does gt just like method need new project public refactor refactoring return use using ve way
rest,api application client code create data does gt http just like method need new post request rest restful server service url use using want way web xml
collections,add class code collection collections does gt java know like list lt need new object public return string use using value want way
compact-framework,application cf code compact device does framework know like mobile need net new thanks using windows
clojure,code defn function java like need use using way
google-app-engine,app appengine application class code com data datastore does engine gae google http like python use using want way
wpf,application binding code control gt like lt new property set use using value want way window wpf xaml
event-handling,add button class click code event events function gt handler handlers like lt new object problem public thanks use using void want way
static,class code function gt know like lt method new object private public use using way
bash,bash command echo file files gt like line output script shell use using want way
datetime,convert date dates datetime format like need string time using want way
sql,data database id like need query select server sql table use using want way
actionscript,actionscript class code flash flex function know like new thanks using var way
exception,application catch class code does error exception exceptions gt just know like message method new object public return string throw thrown try using way
iis-6,application asp error file iis iis6 just like net page running server set site use using want way web website windows
64bit,32 64 64bit application bit code dll error file know machine need net run running use using version windows work x64
automation,application automate automation code file know like need new server use using ve want way work
iphone,app code iphone like thanks use using view want way
debugging,application code debug debugger debugging does just know like studio use using visual way
architecture,application architecture code data design different does example just like need net new question server use using want way web
functional-programming,code does example function functional gt know language like lt programming question return use using
asynchronous,async asynchronous asynchronously calls code data does function just know like make method need new object problem return server thanks time use using want way
visual-studio-2005,2005 code does error file files like net problem project solution studio use using visual vs2005 way
enums,class code enums gt int just like lt public return string type use using value values want way
design-patterns,class code create data design does example just know like method need new object pattern patterns public return use using want way
latex,begin code document end latex like make page problem text thanks use using want way
video,file like need play thanks use using video videos want way
entity-framework-4,add class code context data database ef ef4 entities entity following framework gt id know like lt method model need net new object public return set sql table thanks use using want way
error-handling,application catch class code does error errors exception file handling just like message new page try using want way
model-view-controller,application class code controller data example framework gt just like model mvc need net new use user using view want way
struct,amp array char class code error following function gt int like lt new return sizeof string structs structure type typedef use using value want way
drupal-6,content drupal like module need node page site thanks type use user using ve view want way
reporting-services,2008 data does like need report reporting reports server services set sql ssrs using want way
http,code data file http like post request response server url use using way web
google-maps,api code com function http javascript like location map maps marker markers new problem thanks use using var want way
internet-explorer-8,browser code com css does fine firefox function gt html http ie7 ie8 javascript like lt page problem style text type using work works
ms-word,application code doc document documents file like microsoft ms need new open text use using want way
windows-7,application does error file know like new run running server use using vista way windows work xp
text,code file gt know like lt need string text thanks use using want way
winapi,api application code does function know like use using want way win32 windows
assembly,asm assembly code function know like mov use using
jvm,application code does file java just jvm know like memory new run running server time using vm
vim,file like line use using vim want way
visual-studio-2010,2010 code does file just like net new project studio use using ve visual vs vs2010 way
objective-c,alloc app code iphone like method objective self thanks use using view want way
download,application code content download downloading downloads file files http know like new page server thanks url user using want way web
merge,branch changes code don file files git just like merge merged merging need new svn use using want way
redirect,code com does gt http know like need new page php redirect site thanks url use user using want way www
stl,amp class code const data end function gt int iterator know like lt need return std stl string use using vector want way
iframe,body code com content document function gt html http id javascript like load lt page parent src thanks use using want way window
process,application code exe know like new process processes program run running start use using want way windows
datagrid,add binding code column columns data grid gt like lt need new row set thanks use user using value want way wpf
user-interface,application code gui just like need ui use user using want way
printing,application code file just like need page print printer printing use using want way
colors,background change color colors just know like set text using want way
flash,code file flash function like new swf thanks use using want way
google-chrome,browser code does firefox function google gt html http javascript jquery like lt page problem text thanks type using way work working works
apache,apache com file files htaccess http like mod page php request rewrite server thanks url use using want www
unix,command file files like script unix use using want way
jdbc,class code connection data database driver exception java jdbc like mysql new resultset select sql statement string use using way
garbage-collection,application class code collected collection collector does garbage gc java just know like memory method new object objects time use using
namespaces,class code file following gt http just like lt namespace namespaces need new use using want way xml xmlns
view,gt id just like lt using want way
postgresql,create data database error id like need postgres postgresql query select sql table use using want way
dictionary,class code dict dictionary gt key keys like list lt need new object python return string type use using value values want way
dojo,byid code data dijit div dojotype dojox form function gt html id javascript just like lt new script style text true type use using var want way work
internet-explorer-6,code css div does fine firefox function gt html http ie6 ie7 javascript jquery left like lt page problem text type use using work works
network-programming,application client code data ip just know need network send server socket tcp use using want
checkbox,box check checkbox checkboxes checked code form function gt help id input jquery like lt problem thanks true type using value want
graphics,code draw graphics image just know like need new use using ve want way
security,access application code just know like need net security server use user users using want way web
uiscrollview,addsubview alloc app code delegate does image images iphone like method need page problem screen scroll scrolling scrollview self set size thanks uiscrollview uiview use user using ve view void want way width yes
gtk,code file gtk like set using want window
vb.net,code dim end like net new string use using vb want way
ubuntu,04 10 error file install like run running server ubuntu use using want
sqlite,code create data database db error file id like need new query select sql sqlite table thanks use using want way
drupal,content drupal like module need node page site thanks type use user using want way
templates,amp class code error function gt int know like lt main new public return template templates type typename use using void want way
tags,gt html like lt tag tags thanks use using want way
qt,application code gt like problem qt use using want
service,android app application class code create data does file like need new service services thanks use using want way web windows
sql-server,data database like need query select server sql table use using want way
wix,action application code custom directory dll file files gt id install installation installed installer like lt msi need program run trying use user using ve version want windows
osx,10 application file like mac os thanks use using want way
grails,app application class code def domain following groovy java like new static string thanks use using want way
forms,action button class code data form forms function gt html id input jquery like lt method need new page php post problem submit text thanks type use user using value want way
assemblies,application assemblies assembly class code dll does file like load need net problem project reference use using version want way
openid,account application authentication com google http id like login need net open provider site use user users using way web website
curl,ch close code com curlopt data error exec file gt header http init just like lt need page php post problem request returntransfer script server set setopt thanks true trying type url use using want www
operating-system,code does know linux memory operating os using windows
combobox,add binding box code combo combobox data gt item items like list lt new problem select selected set string text thanks use user using value want way wpf
delegates,class code delegate delegates function gt just like lt method need new object public return use using void want way
linq-to-xml,attribute code data descendants document element elements file following gt http id like linq list load lt need new object query select string thanks trying use using value var want xdocument xelement
indexing,column create data does id index indexes key like need query sql table use using want way
binary,binary code convert data file know like read string use using want way
internet-explorer-7,browsers code com css div does fine firefox function gt html http id ie6 ie7 ie8 issue javascript jquery just know left like lt page problem right text using width work works
open-source,code does know like looking make open project source use using want
batch-file,bat batch command echo file files just like line run script set use using want way windows
unit-testing,class code gt just like method new public run test testing tests unit use using want way
project-management,developers development don just know like make management need project projects small software team time use work
msbuild,build code command does error file files gt like lt microsoft msbuild net problem project projects run server solution target task use using want way
content-management-system,cms content just know like need page php site use using want
mvvm,application bind binding class code data does gt like lt model mvvm need new pattern property public return set thanks type use user using value ve view viewmodel want way wpf xaml
programming-languages,code know language languages like programming use
activex,activex application code control controls create dll error file know like need net object page use using way windows work
ssh,command file host just key know like machine remote run running script server ssh thanks trying use user using ve want way work
wcf,application class client code data error gt http like lt message method need net new server service services use using want way web
if-statement,amp code function gt like lt php statement statements use want
windows-phone-7,app application code gt like lt new phone set silverlight thanks use using want way windows wp7
matlab,code function like matrix use using want way
3d,3d code just know like need point use using ve want way
logging,application file like log logger logging logs use using want way
mobile,android application device does know like mobile need use using way web
oracle,data database like need oracle query select sql table use using want way
hash,code function gt hash just key know like need string use using value want way
syntax,code does gt like lt syntax use
.net,application code like need net new use using want way
textbox,box code form gt like lt need new text textbox thanks type user using value want
editor,code editor file know like text use using want
filesystems,access application directory does file files filesystem just like need use using want way windows write
c#-3.0,class code error gt like lt need new public return string thanks use using value want way
time,00 code date format function like need thanks time using want way
erlang,code does erlang function gt like process use using want way
eclipse,code file java like project use using way
opengl,code color draw gl just know like need opengl problem texture trying use using ve want way
csv,code data excel file files import like line need read row thanks use using want way
list,add code gt like lists lt need new python string using want way
configuration,app application code config configuration file files gt just like lt need server use using want way
webforms,add asp code control data form gt just like lt need net new page server type use user using want way web webforms
methods,class code example function gt java know like lt method methods new object public return string thanks use using void want way
sharepoint,code like list need new page server sharepoint site thanks use user using want way web
.net-2.0,add code does like need net new object server use using ve want way
xaml,binding class code control gt like lt new property set text use using value want way width wpf xaml
joomla,code gt help know like new page php site using want way
oauth,access api app application authentication code com error getting google http key like oauth request secret thanks token twitter url use user using ve way web
asp.net,application asp code gt like lt need net new page server use user using want way web
exception-handling,application catch class code does error example exception exceptions handle handling just know like message method new return string throw try using want way
synchronization,application class code data database java just like make need new problem run server sync synchronization synchronize synchronized thanks thread time use using want way
ssis,data database error file know like need package problem run server source sql table task use using want way
active-directory,account active ad application authentication code directory domain just know ldap like need net new server string use user users using want way web windows
oop,class classes code design example function gt just know like method methods need new object objects public use using want way
uikit,app iphone just like make use using view want way
ant,build code dir does error file files gt jar java like lt need project run script target task use using way xml
pointers,amp array char code function gt int just like lt main memory need new pointer pointers problem return use using void
email,address code com email emails like mail message need new php send sending server subject thanks use user using want way
unicode,ascii character characters code does encoding file gt know like need problem string text unicode use using utf way
silverlight-4.0,app application code data does gt like lt need new silverlight thanks use using want
version-control,changes code control does file files git just like need new project repository server source subversion svn use using ve version want way work working
null,code data does gt like lt null object problem select use using value values way
asp.net-mvc,action application asp class code controller data gt html id like lt model mvc net new page public return use user using view want way web
linq,code data gt like linq list lt need new object public query return select sql string type use using var want way
seo,com content google html http just know like links make need page question search seo site thanks url urls use using want way website www
user-controls,add asp button class code control controls create gt just like lt need net new object page property public set text type use user usercontrol using want way wpf
django-models,charfield class code data db def django field foreignkey length like max model models need object objects return save self set true use user using want way
dataset,add code data database dataset file like net new rows set sql table tables thanks update use using want way
windows,application code file know like need use using want way windows
browser,browser browsers does firefox html javascript know like page use user using want way web
sdk,app code help iphone sdk thanks use using want
asp.net-mvc-2,action application asp class code controller data gt html id like lt model mvc mvc2 need net new page public return set string thanks type use user using view want way web
javascript,code function gt html id javascript jquery like lt page text thanks use using var want way
date,2010 code date dates day format like need new thanks time using want way
vbscript,amp asp code createobject does end error file gt like need script set trying using vbscript want way
jquery-selectors,class click code div element function gt html id input jquery like lt page select selector text thanks trying using value var want work
math,code just know like math need number problem using want way
performance,code data does just know like performance time use using way
filter,code example filter filters function gt know like list lt need return string trying use using want way
junit,class code java junit just like method new run test testing tests unit use using void want way xml
codeigniter,array code codeigniter controller data function gt id just like load lt page php thanks use user using view want way
ruby,code gt like lt new rails ruby use using want way
tdd,best class code create development does doing driven just know like methods need project question tdd test testing tests time unit use using want way write writing
vba,access code data end excel like need set use using vba want way
session,asp code data gt id like need net new page php problem server sessions set use user using want way web
authentication,access application authentication code does http just like login need net new page password server thanks use user username users using want way web
python,code file like python use using want way
formatting,code format formatting like need string use using want way
groovy,class code def following grails groovy gt java just like lt new string use using way
linq-to-sql,class code data database db gt id like linq lt new object public query return select sql table use using var want way
json,ajax array code data function gt id javascript jquery like lt new object return string thanks type url use using var want way
fluent-nhibernate,add class code column create database entity fluent fluentnhibernate following gt id int like list lt map mapping mappings new object problem property public set string table type use using virtual want way
ide,code eclipse ide know like project studio use using visual want way
file-io,code data file files gt like line lt need new open read reading text use using want way write
xhtml,code css gt html http like lt page text use using want xhtml
parameters,code function gt like lt method need new parameter parameters pass passing public return string thanks type use using value want way
iphone-sdk-3.0,app application code does help iphone like thanks using view want
networking,code connection data ip know like need network server thanks use using want way
delphi,application begin code create delphi does end know like need problem use using want way
