asp.net-mvc,action actionresult add application best class code controller create data database does doing don edit error example following form gt html http id jquery just know like list lt make method model need new null object page possible post problem project public question request return server set site string text thanks trying type url use used user using value var ve view views want way web work working works
authentication,access account add app application asp auth authenticate basic best check client code com create credentials data database different does don example following gt http just know like log logged login lt make method need net new page password possible problem question request security server service session set simple site string sure thanks time true trying url use username users using ve want way web windows work working works
logging,add app application best class code create data debug does doesn don error example file files gt info information java just know level like line log4j log4net logger logging logs lt make message messages method need net new output problem question run server set simple thanks time trying type use used user using ve want way web work write
permissions,able access account add allow app application change check code create current database denied directory does don edit error file files folder following group just know level like make need net new permission problem question read run running security server set site specific sql thanks try trying use user users using ve want way web windows work working write
multithreading,app application called class code create created data different does doesn doing don example function gt help int java just know like lock lt main make method multiple need net new object private problem process program public question read return run running server set sleep start static string thanks threading threads time true try trying use used using ve void wait want way windows work
compact-framework,able app application ce cf change class code compact control create data developing device does doesn don error exception file following form framework help just know like looking method mobile need net new object problem program project public run running string studio thanks time true trying use used user using ve visual void want way windows work working
animation,android animate animated animating animations background button change class code com create does doesn don duration example following frame function gt height help http image images iphone jquery just know left like lt make need new object possible problem property question right run screen self set simple thanks time tried trying uiview use user using ve view void want way width work working works wpf
continuous-integration,able automated automatically best better building builds ci code command configuration continuous control create cruisecontrol currently development different does don error file files having hudson integration issue java just know like line looking machine make msbuild nant need net new number plugin possible problem process project projects question really repository run running runs script server set setting setup solution source sure svn task team test testing tests things think time unit update use used using ve version want way web windows work working
linux,application code command does don error file files following gt help just know like line lt make need new problem process program run running script server set thanks time trying use used user using ve want way windows work write
ssh,able access authentication bin code com command commands connect connection directory does doesn don end error example file files git gt help home host just key keys know like line local log lt machine make need new open password possible problem process public python remote run running script server set svn terminal thanks time tried trying use user username using ve want way windows work working works
selenium,4444 application browser button class click code com command different does doesn driver element error example exception file firefox following gt help html http id ide java javascript just like localhost lt method need new open org page problem rc run running script server set setup start string test testing tests text thanks time tried trying type url use user using value ve want way web work works
javascript,ajax alert browser button class click code com data div document does doesn don element event example file following form function gt help html http id input jquery js just know like lt make need new object page possible problem return script text thanks trying type use user using value var ve want way window work working works
firefox,browser browsers button chrome class click code com content css data display div document does doesn error extension ff file fine following function gt height help html http id input javascript jquery js just know like lt make need new open page problem run script set style text thanks tried trying type url use user using value var ve want way web width window work working works
memory,access app application class code data does don error example file following function gt help just know like lt make need new object objects possible problem process program question read return run running size thanks time usage use used using ve void want way
file,application code create data directory does don error example filename files folder following gt help java just know like line lt need new open path php problem read server string text thanks time trying use using want way windows work write
css,100 align background body border browser change class code color com content display div does doesn don element example firefox float font gt height help href html http id image images javascript jquery just know left like link lt make margin need padding page position possible problem right set site size style table text thanks tried trying type use using ve want way width work works
validation,add asp button check class code create data does doesn don error errors example false field fields following form function gt help html id input invalid javascript jquery just know like lt make message method model mvc need net new object page post problem public required return server set string submit text thanks true trying type use user using valid validate validating validator value ve want way work working works
xhtml,body browser class code com content css display div doctype document does example gt height html http id javascript jquery just know like link lt make need new org page problem right site table tag text thanks tr tried trying type use using value ve want way website width www xhtml
cross-browser,amp background border browser browsers button chrome click code color com cross css different display div document does doesn ff fine firefox following form function gt height html http id ie6 ie7 ie8 javascript jquery just know left like lt make need page problem question right safari site style test text thanks type use user using var ve want way web width work working works www
windows-services,access app application code command console create created currently data desktop does doesn don edit error exe file files fine install installed just know like local log machine make method need net new possible problem process program project run running server services set start started stop string sure thanks thread time trying use user using ve want way work working works write
printing,able application browser code content create css data document does don file help html image just know like lt method need net new page pages pdf possible printed printer printers printing prints problem right set size text thanks trying use user using ve want way web windows work
linq,add amp class code contains create data database db does don error example expression following foreach gt help id ienumerable int just key know like list lt method need net new null object objects problem public query question result return select set sql string table thanks tolist trying type use using value values var ve want way work
plugins,add app application class code com create does don error example file function gt help ideas java jquery just know like lt make method need new page php plug plugins problem project question thanks time trying use user using ve want way web work working
ant,apache application class classpath code com command compile create default depends dir directory does doesn don eclipse error execute file files fileset following gt help include jar java just know lib like line lt make need new org output path possible problem project property run running script server set source src target task tasks test thanks time tools tried true trying use using value ve version want way work working works xml
build-process,add ant application building builds built change check code command common compile configuration control create dependencies development different directory dll does doesn don file files folder gt guess help include integration java just know like lt make maven msbuild nant need net new possible problem process project projects really reference release run script server set solution source studio target test thanks think time tool tried trying use used using ve version visual want way work working works xml
collections,add array arraylist class code collection collections contains create data dictionary does doing don elements error example following generic good gt id int item items java just key know like list lt method need net new object objects possible private problem property public question return set string thanks time trying type use used using value values ve void want way
osx,10 app apple application cocoa code command create does don error file files following gt help install just know library like line mac make need new open os osx problem run running set thanks time tried trying use using ve version want way windows work working works
